{
  "id": "base:bacon_roll_large",
  "type": "recipe",
  "name": "loc:recipe.bacon_roll_large",
  "price": 9.8,
  "station_primary": "griddle",
  "ingredients": [
    {
      "product": "base:sourdough",
      "qty": 1.4,
      "unit": "roll"
    },
    {
      "product": "base:bacon",
      "qty": 84.0,
      "unit": "g"
    }
  ],
  "steps": [
    {
      "station": "prep",
      "action": "prep",
      "seconds": 45,
      "tolerance": 10
    },
    {
      "station": "griddle",
      "action": "cook",
      "seconds": 60,
      "tolerance": 10
    },
    {
      "station": "griddle",
      "action": "assemble",
      "seconds": 20,
      "tolerance": 4
    },
    {
      "station": "griddle",
      "action": "plate",
      "seconds": 6,
      "tolerance": 3
    }
  ],
  "modifiers_allowed": [
    "omission",
    "addition",
    "substitution",
    "preparation",
    "portioning",
    "quantity"
  ],
  "store_credit_eligible": false,
  "unlocked_by": "base:food_service"
}
