{
  "id": "base:cold_brew_glass",
  "type": "recipe",
  "name": "loc:recipe.cold_brew_glass",
  "price": 4.2,
  "station_primary": "coffee_bar",
  "ingredients": [
    {
      "product": "base:cold_brew",
      "qty": 1.0,
      "unit": "each"
    }
  ],
  "steps": [
    {
      "station": "prep",
      "action": "prep",
      "seconds": 8,
      "tolerance": 10
    },
    {
      "station": "coffee_bar",
      "action": "cook",
      "seconds": 8,
      "tolerance": 4
    }
  ],
  "modifiers_allowed": [
    "omission",
    "addition",
    "substitution",
    "preparation",
    "portioning",
    "quantity"
  ],
  "store_credit_eligible": true,
  "unlocked_by": "base:general_retail"
}
