{
  "id": "base:loaded_fries",
  "type": "recipe",
  "name": "loc:recipe.loaded_fries",
  "price": 6.5,
  "station_primary": "fryer",
  "ingredients": [
    {
      "product": "base:cheddar",
      "qty": 40.0,
      "unit": "g"
    }
  ],
  "steps": [
    {
      "station": "prep",
      "action": "prep",
      "seconds": 95,
      "tolerance": 6
    },
    {
      "station": "fryer",
      "action": "cook",
      "seconds": 8,
      "tolerance": 3
    },
    {
      "station": "fryer",
      "action": "assemble",
      "seconds": 95,
      "tolerance": 6
    }
  ],
  "modifiers_allowed": [
    "omission",
    "addition",
    "substitution",
    "preparation",
    "portioning",
    "quantity"
  ],
  "store_credit_eligible": false,
  "unlocked_by": "base:food_service"
}
