{
  "id": "base:three_cheese_toastie_to_share",
  "type": "recipe",
  "name": "loc:recipe.three_cheese_toastie_to_share",
  "price": 16.15,
  "station_primary": "griddle",
  "ingredients": [
    {
      "product": "base:sourdough",
      "qty": 3.8,
      "unit": "slice"
    },
    {
      "product": "base:cheddar",
      "qty": 114.0,
      "unit": "g"
    },
    {
      "product": "base:butter",
      "qty": 22.8,
      "unit": "g"
    }
  ],
  "steps": [
    {
      "station": "prep",
      "action": "prep",
      "seconds": 8,
      "tolerance": 10
    },
    {
      "station": "griddle",
      "action": "cook",
      "seconds": 60,
      "tolerance": 4
    },
    {
      "station": "griddle",
      "action": "assemble",
      "seconds": 6,
      "tolerance": 3
    },
    {
      "station": "griddle",
      "action": "plate",
      "seconds": 20,
      "tolerance": 14
    },
    {
      "station": "griddle",
      "action": "melt",
      "seconds": 8,
      "tolerance": 4
    }
  ],
  "modifiers_allowed": [
    "omission",
    "addition",
    "substitution",
    "preparation",
    "portioning",
    "quantity"
  ],
  "store_credit_eligible": false,
  "unlocked_by": "base:food_service"
}
